2024,IROS,"Energy-efficient Trajectory Planning with Media Transition for a Hybrid Unmanned Aerial-Underwater Vehicle.",Pedro M. Pinheiro; Armando Alves Neto; Douglas G. Macharet; Paulo Lilles Jorge Drews,https://doi.org/10.1109/IROS58592.2024.10802863,null,C,no_arxiv,0
2023,IROS,"EvCenterNet: Uncertainty Estimation for Object Detection Using Evidential Learning.",Monish R. Nallapareddy; Kshitij Sirohi; Paulo Lilles Jorge Drews; Wolfram Burgard; Chih-Hong Cheng; Abhinav Valada,https://doi.org/10.1109/IROS55552.2023.10341826,null,C,http://arxiv.org/abs/2303.03037v2,0
2022,IEEE RA-L,"Cross-View and Cross-Domain Underwater Localization Based on Optical Aerial and Acoustic Underwater Images.",Matheus Machado dos Santos; Giovanni G. De Giacomo; Paulo L. J. Drews-Jr; Silvia S. C. Botelho,https://doi.org/10.1109/LRA.2022.3154482,null,J,no_arxiv,0
2022,IROS,"Depth-CUPRL: Depth-Imaged Contrastive Unsupervised Prioritized Representations in Reinforcement Learning for Mapless Navigation of Unmanned Aerial Vehicles.",Junior Costa de Jesus; Victor Augusto Kich; Alisson Henrique Kolling; Ricardo B. Grando; Rodrigo da Silva Guerra; Paulo Lilles Drews Jr.,https://doi.org/10.1109/IROS47612.2022.9982161,null,C,no_arxiv,0
2021,ICRA,"Deep Reinforcement Learning for Mapless Navigation of a Hybrid Aerial Underwater Vehicle with Medium Transition.",Ricardo B. Grando; Junior Costa de Jesus; Victor Augusto Kich; Alisson Henrique Kolling; Nicolas P. Bortoluzzi; Pedro M. Pinheiro; Armando Alves Neto; Paulo Lilles Jorge Drews Junior,https://doi.org/10.1109/ICRA48506.2021.9561188,null,C,no_arxiv,0
2020,IEEE RA-L,"Matching Color Aerial Images and Underwater Sonar Images Using Deep Learning for Underwater Localization.",Matheus Machado dos Santos; Giovanni G. De Giacomo; Paulo L. J. Drews-Jr; Silvia S. C. Botelho,https://doi.org/10.1109/LRA.2020.3013852,null,J,no_arxiv,0
