2020,IEEE RA-L,"SLOAM: Semantic Lidar Odometry and Mapping for Forest Inventory.",ICMC/USP,Steven W. Chen; Guilherme V. Nardari; Elijah S. Lee; Chao Qu; Xu Liu 0007; Roseli A. Francelin Romero; Vijay Kumar 0001,https://doi.org/10.1109/LRA.2019.2963823,null,J,http://arxiv.org/abs/1912.12726v1,0
2020,IROS,"Adaptive Partitioning for Coordinated Multi-agent Perimeter Defense.",UFMG,Douglas G. Macharet; Austin K. Chen; Daigo Shishika; George J. Pappas; Vijay Kumar 0001,https://doi.org/10.1109/IROS45743.2020.9341417,null,C,no_arxiv,0
2020,IROS,"Game Theoretic Formation Design for Probabilistic Barrier Coverage.",UFMG,Daigo Shishika; Douglas G. Macharet; Brian M. Sadler; Vijay Kumar 0001,https://doi.org/10.1109/IROS45743.2020.9340724,null,C,no_arxiv,0
2020,IROS,"Global Localization Over 2D Floor Plans with Free-Space Density Based on Depth Information.",UFRGS,Renan Maffei; Diego Pittol; Mathias Mantelli; Edson Prestes; Mariana Luderitz Kolberg,https://doi.org/10.1109/IROS45743.2020.9340642,null,C,no_arxiv,0
2020,J. Intelligent & Robotic Syst.,"CNN Based Image Restoration.",FURG,Cristiano Rafael Steffens; Lucas Ricardo Vieira Messias; Paulo L. J. Drews-Jr; Silvia Silva da Costa Botelho,https://doi.org/10.1007/s10846-019-01124-9,null,J,no_arxiv,0
2020,J. Intelligent & Robotic Syst.,"Cloud-SPHERE: Towards Secure UAV Service Provision.",ICMC/USP,Mariana Rodrigues; Kalinka Regina Lucas Jaquie Castelo Branco,https://doi.org/10.1007/s10846-019-01046-6,null,J,no_arxiv,0
2020,J. Intelligent & Robotic Syst.,"Dynamic Leader Allocation in Multi-robot Systems Based on Nonlinear Model Predictive Control.",UFPB,Augusto de Holanda B. M. Tavares; Sarah Pontes Madruga; Alisson V. Brito; Tiago P. Nascimento,https://doi.org/10.1007/s10846-019-01064-4,null,J,no_arxiv,0
2020,J. Intelligent & Robotic Syst.,"Extending Maps with Semantic and Contextual Object Information for Robot Navigation: a Learning-Based Framework Using Visual and Depth Cues.",UFMG,Renato Martins; Dhiego Bersan; Mario F. M. Campos; Erickson R. Nascimento,https://doi.org/10.1007/s10846-019-01136-5,null,J,no_arxiv,0
2020,J. Intelligent & Robotic Syst.,"Hybridisation of Sequential Monte Carlo Simulation with Non-linear Bounded-error State Estimation Applied to Global Localisation of Mobile Robots.",UFRGS,Robin Weiss; Peter Glösekötter; Edson Prestes; Mariana Luderitz Kolberg,https://doi.org/10.1007/s10846-019-01118-7,null,J,no_arxiv,0
2020,J. Intelligent & Robotic Syst.,"Introduction to the Robotica 2018 Special Issue.",UFPB; UFRN,Tiago P. Nascimento; Alisson V. Brito; Esther Luna Colombini; Luiz Marcos Garcia Gonçalves,https://doi.org/10.1007/s10846-019-01135-6,null,J,no_arxiv,0
2020,J. Intelligent & Robotic Syst.,"LoPoFly: Location and Positioning Optimization for Flying Networks.",UTFPR,Giovanna G. Basilio; Ana Cristina B. Kochem Vendramin; Hermes Irineu Del Monego; Anelise Munaretto,https://doi.org/10.1007/s10846-020-01194-0,null,J,no_arxiv,0
2020,J. Intelligent & Robotic Syst.,"Localization Using Ultra Wideband and IEEE 802.15.4 Radios with Nonlinear Bayesian Filters: a Comparative Study.",UFMG,Elerson Rubens da Silva Santos; Héctor Azpúrua; Paulo A. F. Rezeck; Maurício F. S. Corrêa; Marcos Augusto M. Vieira; Gustavo Medeiros Freitas; Douglas G. Macharet,https://doi.org/10.1007/s10846-019-01126-7,null,J,no_arxiv,0
2020,J. Intelligent & Robotic Syst.,"Monocular 3D Exploration using Lines-of-Sight and Local Maps.",UFRGS,Diego Pittol; Mathias Mantelli; Renan Maffei; Mariana Luderitz Kolberg; Edson Prestes,https://doi.org/10.1007/s10846-020-01208-x,null,J,no_arxiv,0
2020,J. Intelligent & Robotic Syst.,"Pure Perception Motion Control based on Stochastic Nonlinear Model Predictive Control.",UFRN; UFPB,Tiago Pereira do Nascimento; Carlos E. T. Dórea; Luiz Marcos Garcia Gonçalves,https://doi.org/10.1007/s10846-019-01141-8,null,J,no_arxiv,0
2020,J. Intelligent & Robotic Syst.,"Robotic Standard Development Life Cycle in Action.",UFRGS,Joanna Isabelle Olszewska; Michael Houghtaling; Paulo Jorge Sequeira Gonçalves; Nicola Fabiano; Tamás Haidegger; Joel Luis Carbonera; William Remington Patterson; S. Veera Ragavan; Sandro Rama Fiorini; Edson Prestes,https://doi.org/10.1007/s10846-019-01107-w,null,J,no_arxiv,0
2020,J. Intelligent & Robotic Syst.,"Socially Acceptable Navigation of People with Multi-robot Teams.",UFMG; ICMC/USP,Murillo Rehder Batista; Douglas Guimarães Macharet; Roseli Aparecida Francelin Romero,https://doi.org/10.1007/s10846-019-01080-4,null,J,no_arxiv,0
2020,J. Intelligent & Robotic Syst.,"Special Issue on Elderly Care Robotics - Technology and Ethics.",UFRGS,Jim Tørresen; Ryo Kurazume; Edson Prestes,https://doi.org/10.1007/s10846-020-01148-6,null,J,no_arxiv,0
2020,J. Intelligent & Robotic Syst.,"Strategies for Patrolling Missions with Multiple UAVs.",UFPEL,Kristofer S. Kappel; Taua M. Cabreira; João Luis Marins; Lisane B. de Brisolara; Paulo R. Ferreira Jr.,https://doi.org/10.1007/s10846-019-01090-2,null,J,no_arxiv,0
2020,J. Intelligent & Robotic Syst.,"Using Ontology as a Strategy for Modeling the Interface Between the Cognitive and Robotic Systems.",ICMC/USP,Helio Azevedo; Jose Pedro Ribeiro Belo; Roseli A. F. Romero,https://doi.org/10.1007/s10846-019-01076-0,null,J,no_arxiv,0
2020,Robotics & Autonomous Syst.,"On the consensus of nonlinear agents in unknown cluttered environments using random planning.",UFMG,Armando Alves Neto; Leonardo A. Mozelli; Douglas G. Macharet,https://doi.org/10.1016/j.robot.2020.103607,null,J,no_arxiv,0
2020,Robotics & Autonomous Syst.,"Three level sequence-based Loop Closure Detection.",UFRGS,Fernanda Rodrigues; Renata Neuland; Mathias Mantelli; Diego Pittol; Renan Maffei; Edson Prestes; Mariana Luderitz Kolberg,https://doi.org/10.1016/j.robot.2020.103620,null,J,no_arxiv,0
